{
  "id": "6a0ca582123fd2fcbcf69c90",
  "title": "Memorial Day Dyson Vacuum Deals: V15 Detect, Gen5Detect, PencilVac On Sale",
  "url": "https://www.wired.com/story/dyson-vacuum-deals-memorial-day-2026/",
  "description": "Wishing for your very own Dyson vacuum? Don't miss these vacuum deals happening over the holiday weekend.",
  "datePublished": "2026-05-23T13:37:45Z",
  "publisher": "Condé Nast",
  "brand": "Wired",
  "edition": "US",
  "author": ["Wired Gear Team"],
  "section": "Gear",
  "categories": [
    "Gear",
    "Gear / Deals"
  ],
  "subject": "Deals",
  "keywords": ["Dyson", "Vacuums", "Memorial Day", "Deals"],
  "thumbnail": {
    "url": "https://media.wired.com/photos/dyson-v15-detect.jpg",
    "width": 1200,
    "height": 800
  },
  "breadcrumb": [
    { "position": 1, "name": "Gear", "url": "https://www.wired.com/gear/" },
    { "position": 2, "name": "Shopping", "url": "https://www.wired.com/tag/shopping/" },
    { "position": 3, "name": "The Dyson Vacuum Deals to Snag This Memorial Day" }
  ]
}
